OAE:0001141,obsolete lower gastrointestinal hemorrhage AE,Class,obsolete class,lower gastrointestinal haemorrhage AE,,a gastrointestinal hemorrhage AE that has an outcome of bleeding in the lower gastrointestinal tract,WEB: http://www.nlm.nih.gov/medlineplus/ency/article/003133.htm,,10050953,"SZ, DJ, SS, YH",true,http://purl.obolibrary.org/obo/IAO_0000227,OAE:0003356
OAE:0008718,obsolete lung consolidation AE,Class,obsolete class,,肺实变,This is an AE which is a region of normally compressible lung tissue that has filled with liquid instead of air.,http://en.volupedia.org/wiki/Pulmonary_consolidation,,10025080,"QY, JX, HY",true,http://purl.obolibrary.org/obo/IAO_0000227,OAE:0001143
OAE:0001169,obsolete menometrorrhagia AE,Class,obsolete class,,,Hematuria AE that results in excessive uterine bleeding occurs irregularly and more frequently than normal,WEB: http://medical-dictionary.thefreedictionary.com/menometrorrhagia,,10027295,"SZ, SS, YH",true,http://purl.obolibrary.org/obo/IAO_0000227,OAE:0008450
OAE:0004281,obsolete menorrhagia AE,Class,obsolete class,hypermenorrhea AE,,a menstrual disorder AE that shows a menstrual period with abnormally heavy flow and falls under the larger category of abnormal uterine bleeding (AUB),WEB: https://en.wikipedia.org/wiki/Menorrhagia,,,"QL, YH",true,http://purl.obolibrary.org/obo/IAO_0000227,OAE:0001170
OAE:0007790,obsolete myofascitis AE,Class,obsolete class,,肌筋膜炎,"This is an AE which main cause of the disease is aseptic inflammation of local muscles and connective tissues such as myofascial, which can be manifested as paralysis, distension, and other discomfort, local muscle stiffness, spasm or palpable strain-like nodules.",https://pubmed.ncbi.nlm.nih.gov/34114979/,,10052443,"QY, JX, HY",true,http://purl.obolibrary.org/obo/IAO_0000227,OAE:0004238
OAE:0007782,obsolete myopathy AE,Class,obsolete class,,肌病,This is an AE which is a disease of the muscle  in which the muscle fibers do not function properly.,http://en.volupedia.org/wiki/Myopathy,,10028641,"QY, JX, HY",true,http://purl.obolibrary.org/obo/IAO_0000227,OAE:0000525
OAE:0005484,obsolete necrosis ischemic AE,Class,obsolete class,,缺血性坏死,,,,10028862,"QY, JX, HY",true,http://purl.obolibrary.org/obo/IAO_0000227,OAE:0001204
OAE:0008449,obsolete nephritis AE,Class,obsolete class,,性肾炎,"This is an AE which is inflammation of the kidneys and may involve the glomeruli, tubules, or interstitial tissue surrounding the glomeruli and tubules.",http://en.volupedia.org/wiki/Nephritis,,10029117,"QY, JX, HY",true,http://purl.obolibrary.org/obo/IAO_0000227,OAE:0004447
OAE:0004687,obsolete neurotoxicity AE,Class,obsolete class,,神经毒性,"This is an AE which is a form of toxicity in which a biological, chemical, or physical agent produces an adverse effect on the structure or function of the central and/or peripheral nervous system.",http://en.volupedia.org/wiki/Neurotoxicity,,10029350,"QY, JX, HY",true,http://purl.obolibrary.org/obo/IAO_0000227,OAE:0001215
OAE:0006484,obsolete normochromic normocytic anemia AE,Class,obsolete class,,正色素性正细胞性贫血,This is an AE which is a common complication in chronic kidney disease and is associated with many adverse clinical consequences.,https://pubmed.ncbi.nlm.nih.gov/26372086/,,10029783,"QY, JX, HY",true,http://purl.obolibrary.org/obo/IAO_0000227,OAE:0001227
OAE:0006080,obsolete nystagmus AE,Class,obsolete class,,眼球震颤,"This is an AE which is a condition of involuntary (or voluntary, in some cases) eye movement.",http://en.volupedia.org/wiki/Nystagmus,,10029864,"QY, JX, HY",true,http://purl.obolibrary.org/obo/IAO_0000227,OAE:0000048
OAE:0001235,obsolete oligohydramnios AE,Class,obsolete class,placental dysfunction AE,,"a reproductive system AE that has an outcome of insufficient placenta, the baby may get less oxygen and nutrients",WEB: http://www.ncbi.nlm.nih.gov/pubmedhealth/PMH0002455/,,10030289,"SZ, SS, YH",true,http://purl.obolibrary.org/obo/IAO_0000227,OAE:0008261
OAE:0009343,obsolete oliguria AE,Class,obsolete class,,尿过少,This is an AE which is the low output of urine specifically more than 80 ml/day but less than 100ml/day.,http://en.volupedia.org/wiki/Oliguria,,10030302,"QY, JX, HY",true,http://purl.obolibrary.org/obo/IAO_0000227,OAE:0004226
OAE:0006095,obsolete ophthalmic artery thrombosis AE,Class,obsolete class,,眼动脉血栓形成,"This is an AE which is the formation of a blood clot inside a ophthalmic artery  blood vessel, obstructing the flow of blood through the circulatory system.",http://en.volupedia.org/wiki/Thrombosis,,10081144,"QY, JX, HY",true,http://purl.obolibrary.org/obo/IAO_0000227,OAE:0004559
OAE:0006102,obsolete orbital edema AE,Class,obsolete class,,眼眶水肿,This is an AE which is the build-up of fluid in the orbital  tissue.,http://en.volupedia.org/wiki/Edema,,10031051,"QY, JX, HY",true,http://purl.obolibrary.org/obo/IAO_0000227,OAE:0001252
OAE:0002685,obsolete osteonecrosis of jaw AE,Class,obsolete class,,,a necrosis AE that has a necrotic process occurring in the bone of the mandible.,,,10064658,"MW, YH",true,http://purl.obolibrary.org/obo/IAO_0000227,OAE:0001260
OAE:0002529,obsolete parotitis AE,Class,obsolete class,,,"A parotid gladn enlargement AE that has an outcome of parotitis, the inflammation of one or more of the parotid glands.",WEB: http://emedicine.medscape.com/article/882461-overview|WEB: http://www.nlm.nih.gov/medlineplus/ency/article/001041.htm,,10034038,"KM, YH",true,http://purl.obolibrary.org/obo/IAO_0000227,OAE:0001964
OAE:0007744,obsolete pathological fracture AE,Class,obsolete class,,病理性骨折,This is an AE which is a bone fracture caused by weakness of the bone structure that leads to decrease mechanical resistance to normal mechanical loads.,http://en.volupedia.org/wiki/Pathologic_fracture,,10034156,"QY, JX, HY",true,http://purl.obolibrary.org/obo/IAO_0000227,OAE:0001280
OAE:0006225,obsolete periorbital edema AE,Class,obsolete class,,眶周水肿,This is an AE which is the build-up of fluid in the periorbital tissue.,http://en.volupedia.org/wiki/Edema,,10034545,"QY, JX, HY",true,http://purl.obolibrary.org/obo/IAO_0000227,OAE:0000681
OAE:0006434,obsolete peripheral artery thrombosis AE,Class,obsolete class,,外周动脉血栓形成,This is an AE which occurs when a blood clot forms in the artery that provides blood flow to the peripheral.,http://en.volupedia.org/wiki/Hepatic_artery_thrombosis,,10072564,"QY, JX, HY",true,http://purl.obolibrary.org/obo/IAO_0000227,OAE:0004539
OAE:0005788,obsolete pharyngeal edema AE,Class,obsolete class,,咽部水肿,This is an AE which is the build-up of fluid in the pharyngeal tissue.,http://en.volupedia.org/wiki/Edema,,10034829,"QY, JX, HY",true,http://purl.obolibrary.org/obo/IAO_0000227,OAE:0000342
OAE:0009317,obsolete pitting edema AE,Class,obsolete class,,凹陷性水肿,,,,10035076,"QY, JX, HY",true,http://purl.obolibrary.org/obo/IAO_0000227,OAE:0001935
OAE:0008705,obsolete pneumomediastinum AE,Class,obsolete class,,纵隔气肿,This is an AE which is pneumatosis (abnormal presence of air or other gas) in the mediastinum.,http://en.volupedia.org/wiki/Pneumomediastinum,,10050184,"QY, JX, HY",true,http://purl.obolibrary.org/obo/IAO_0000227,OAE:0001304
OAE:0005133,obsolete pulmonary artery thrombosis AE,Class,obsolete class,,肺动脉血栓形成,"This is an AE which is the formation of a pulmonary artery blood clot inside a blood vessel, obstructing the flow of blood through the circulatory system.",http://en.volupedia.org/wiki/Thrombosis,,10037340,"QY, JX, HY",true,http://purl.obolibrary.org/obo/IAO_0000227,OAE:0004581
OAE:0001363,obsolete reflux esophagitis AE,Class,obsolete class,reflux oesophagitis AE,,"a digestive system AE located in the esophagus, can present with heartburn, and nausea, caused by gastroesophageal reflux disease",WEB: http://medical-dictionary.thefreedictionary.com/esophagitis,,10038263,"SZ, SS, YH",true,http://purl.obolibrary.org/obo/IAO_0000227,OAE:0005757
OAE:0005869,obsolete regurgitation AE,Class,obsolete class,,反流,"This is an AE which is the expulsion of material from the pharynx, or esophagus, usually characterized by the presence of undigested food or blood.",http://en.volupedia.org/wiki/Regurgitation_(digestion),,10067171,"QY, JX, HY",true,http://purl.obolibrary.org/obo/IAO_0000227,OAE:0001988
OAE:0007506,obsolete renal tubular necrosis AE,Class,obsolete class,,肾小管坏死,This is an AE which is a medical condition involving the death of tubular epithelial cells that form the renal tubules of the kidneys.,http://en.volupedia.org/wiki/Acute_tubular_necrosis,,10038540,"QY, JX, HY",true,http://purl.obolibrary.org/obo/IAO_0000227,OAE:0004453
OAE:0006120,obsolete retinal artery thrombosis AE,Class,obsolete class,,视网膜动脉血栓形成,"This is an AE which is the formation of a blood clot inside a retinal artery vessel, obstructing the flow of blood through the circulatory system.",http://en.volupedia.org/wiki/Thrombosis,,10038831,"QY, JX, HY",true,http://purl.obolibrary.org/obo/IAO_0000227,OAE:0004563
OAE:0009180,obsolete stevens-johnson syndrome AE,Class,obsolete class,,史蒂文斯-约翰逊综合征,This is an AE which is a type of severe skin reaction.,http://en.volupedia.org/wiki/Stevens%E2%80%93Johnson_syndrome,,10042033,"QY, JX, HY",true,http://purl.obolibrary.org/obo/IAO_0000227,OAE:0001425
OAE:0007277,obsolete suture related complication AE,Class,obsolete class,,缝合相关并发症,This is an AE which is an suture related unfavorable result of a disease.,http://en.volupedia.org/wiki/Complication_(medicine),,10059059,"QY, JX, HY",true,http://purl.obolibrary.org/obo/IAO_0000227,OAE:0001439
OAE:0008073,obsolete tongue edema AE,Class,obsolete class,,舌水肿,This is an AE which is the build-up of fluid in the tongue tissue.,http://en.volupedia.org/wiki/Edema,,10043967,"QY, JX, HY",true,http://purl.obolibrary.org/obo/IAO_0000227,OAE:0000472
OAE:0002643,obsolete vagus nerve disorder AE,Class,obsolete class,,,a cranial neuropathy AE that has  involvement of the vagus nerve (tenth cranial nerve).,,,10061403,"MW, YH",true,http://purl.obolibrary.org/obo/IAO_0000227,OAE:0004731
OAE:0005269,obsolete ventricular arrhythmia AE,Class,obsolete class,,室性心律失常,This is an AE which is a type of arrhythmia.,http://en.volupedia.org/wiki/Arrhythmia#Ventricular_arrhythmia,,10047281,"QY, JX, HY",true,http://purl.obolibrary.org/obo/IAO_0000227,OAE:0002580
OAE:0002045,obsolete vesicular rash AE,Class,obsolete class,rash vesicular AE,,a rash AE characterized by the formation of vesicles,WEB: http://www.merriam-webster.com/medical/vesicular,,10037898,RR,true,http://purl.obolibrary.org/obo/IAO_0000227,OAE:0002540